,tweet,language,mentions
2447,wish rallies pe thoda control hoga vaise bhi exams cancel ho sakte hai fir rallies kyo nahi,en,[]
2448,bahut din ho gaye ji tv pe dekhe hue main aasha karta hu aap bhi corona se grasit nahi hai,hi,"[{'screen_name': 'payodhi_shashi', 'name': 'payodhi shashi sharma', 'id': '835654662'}]"
2449,fir bhi ki rajmata italian ko abroad jaana padta hai routine check ke lite dever ji ke naam pe hospital hone ke baad bhi,hi,"[{'screen_name': 'incindia', 'name': 'congress', 'id': '1153045459'}]"
2450,,hi,"[{'screen_name': 'incindia', 'name': 'congress', 'id': '1153045459'}, {'screen_name': 'incindia', 'name': 'congress', 'id': '1153045459'}]"
2451,think virtual rally best,en,[]
2452,,hi,[]
2453,,hi,[]
2454,face tears joy face tears joy,und,[]
2455,bangladeshi hai isliye bol rahe hai isme aptti wala bayan kuch bhi nahi hai jispe chunav action legi rahul sinha ne char jihadiyo ki maut ko justify zahir si baat hai ban lagega hi,hi,[]
2456,didi stopped speech time india democracy became didi candidate win seats panchayat without contest time became white day democracy excellent,en,"[{'screen_name': 'mamataofficial', 'name': 'mamata banerjee', 'id': '2526794479'}, {'screen_name': 'ecisveep', 'name': 'election commission of india #sveep', 'id': '1107605032801718274'}, {'screen_name': 'mamataofficial', 'name': 'mamata banerjee', 'id': '2526794479'}]"
2457,believe opposition parties fault lines rich person able buy mlas alone think fault lines understand good day,en,"[{'screen_name': 'jm_scindia', 'name': 'jyotiraditya m. scindia', 'id': '2892809359'}, {'screen_name': 'bjp4india', 'name': 'bjp', 'id': '207809313'}]"
2458,question mla bought cash bank transfer cash possible huge amount case reached ruling state banking transfer details transfer money,en,[]
2459,thoda oppositions ko bhi apni kamiya ginni chahiye aakhir kya kami hai party hai yaa kyo itna chunav haarti hai,hi,[]
2460,jaha tak mujhe pata hai karnataka bjp hi jeeti thi majority naa hone ke karan satta se haath dho baithi thi aur mp ke poll elections bjp ne majority hasil ki thi,hi,[]
2461,kyoki bhadkaya isi ne hi crpf ka ghirav karo,und,[]
2462,understand frustration didi repeat sad way conduct municipal corporation elections,en,"[{'screen_name': 'mamataofficial', 'name': 'mamata banerjee', 'id': '2526794479'}]"
2463,case coalition govt bjp fighting alone,en,[]
2464,hmm zinda kaumen saal tak intezar nahi karti kya pankti arth samjhayenge,hi,[]
2465,sirf naam matr hi kolkata metro politant city hai aur tulna bihar ke cities ke saath,hi,[]
2466,send paragraph,en,[]
2467,less platforms like raise issue men violence,en,"[{'screen_name': 'aktkadmin', 'name': 'aaj ki taza khabar (youtube channel)', 'id': '2978821568'}, {'screen_name': 'frustindian', 'name': 'the frustrated indian', 'id': '794874013'}]"
2468,society start talking men injustice men also feelings pains unfortunately discussion mainstream well found documentary youtube channel,en,"[{'screen_name': 'aktkadmin', 'name': 'aaj ki taza khabar (youtube channel)', 'id': '2978821568'}]"
2469,even learnt islam brought democracy india,en,[]
2470,understand islam shantir protik,en,[]
2471,ab ji bharat ki rajneeti ek kahavat humesha feet rahi hai apna kaam banta bhad jaaye janata,hi,"[{'screen_name': 'mahimapandey90', 'name': 'mahima pandey', 'id': '1298679528269602817'}]"
2472,ise bhav dena nahi ise chutki lena kehte hai,hi,[]
2473,didi loosing election understand frustration think said muslims divide votes election sure party split suggestion join,en,"[{'screen_name': 'incindia', 'name': 'congress', 'id': '1153045459'}]"
2474,personal request sir sir channel growing fast time open regional channel specially south indian states important words reach people south well good day tomorrow,en,"[{'screen_name': 'theatulmishra', 'name': 'atul mishra', 'id': '77273113'}, {'screen_name': 'frustindian', 'name': 'the frustrated indian', 'id': '794874013'}]"
2475,really like channel everything alternative best destroy agenda left ecosystem appreciate fantastic work,en,"[{'screen_name': 'tfipost', 'name': 'tfipost.com', 'id': '827185873301037056'}, {'screen_name': 'tfipost', 'name': 'tfipost.com', 'id': '827185873301037056'}, {'screen_name': 'theatulmishra', 'name': 'atul mishra', 'id': '77273113'}, {'screen_name': 'itsshubhangi', 'name': 'shubhangi sharma', 'id': '1037431008'}, {'screen_name': 'laffajpanditind', 'name': 'animesh pandey 🇮🇳', 'id': '2587002229'}, {'screen_name': 'mahimapandey90', 'name': 'mahima pandey', 'id': '1298679528269602817'}]"
2476,survey hoke rahega,hi,[]
2477,simple question muslim community happened mecca medina tolerate people burnt bangalore mla nephew posted muhammad fb,en,[]
2478,third front said general narvade,en,[]
2479,face tears joy face tears joy,und,[]
2480,ye lockdown lagana aur naa lagana equal hai,en,[]
2481,apna kaam banta bhaad jaaye janta,hi,[]
2482,isliye buri tarah thookega ye,in,[]
2483,neki aur puch puch koi baat nahi kisi aur tarike se upar pahuchane ka kaam kiya jaaye,hi,[]
2484,kya ye bhk waala tweeter baan ji ke liye hai,hi,"[{'screen_name': 'rohini_sgh', 'name': 'rohini singh', 'id': '267861878'}]"
2485,aur jab aur ji ke teht bangkok holiday manake jeeta jaa sakta hai kya zaroorat hai naxal attack stunt aur rallies ki evm hai hi,hi,"[{'screen_name': 'incindia', 'name': 'congress', 'id': '1153045459'}, {'screen_name': 'rahulgandhi', 'name': 'rahul gandhi', 'id': '3171712086'}]"
2486,par mohtarma mazra chhattisgarh ka hai west bengal assam se iska kya lena dena aur agar ye chunavi stunt hai kyo hua tha naxal attack tab amit shah aur pm modi bharat ki mukhya rajneeti itne sakriye bhi nahi,hi,[]
2487,think one election necessary saare chunav ek hi baar samapt,en,[]
2488,campaigning west bengal assam south indian states,en,[]
2489,non bjp party get votes get backlashes,en,[]
2490,today evm found tmc leader gautam ghosh house,en,[]
2491,lekin ab center ko hi ilaj karna chahiye iska,hi,[]
2492,way naxalism bhi communist ideology ka hi hissa hai,en,[]
2493,told one thing necessary either bluetooth yaa internet connection wireless thing necessary hack something,en,[]
2494,parties together guard office think better competitors,en,[]
2495,one option voting conduct election parties focus evm ballot kept office crpf also gurad outside like bsp party,en,[]
2496,ho sakta hai evm badle jaa sakte hai jaise ballot paper change ho sakte hai lekin hacking ke liye bluetooth yaa internet connection ka hona zaroori hai,hi,[]
2497,kisi chiz ko hack karne ke liye bluetooth internet connection dono se ek bhi chiz agar device rehti hai tabhi vo hack ho jaayegi lekin indian evm dono se kuch bhi nahi hai,hi,[]
2498,good example state election j amp k bihar election west bengal panchayat election evm safe ballot paper also safe ballot paper much easier change rather evm next time online voting best,en,[]
2499,lekin mohtarma modi communal hai,et,[]
2500,,hi,[]
2501,,hi,[]
2502,fir bhi aaj tak prove nahi kar paa rahe ho sirf hawa tir hi chala rahe ho,hi,[]
2503,bhai sahab thoda manila apradh ke saath purush apradh bhi add karlo vo bhi aaj kal badh rahe hai,hi,[]
2504,kaha road pe hai,et,[]
2505,hey bhagwan tum bhai sahab rehn,in,[]
2506,ji inke bas ki baat hai kya ramayan padhna jaise log din raat kaise modi voters ko gaali dene se fursat mile,hi,"[{'screen_name': 'gauravpandhi', 'name': 'gaurav pandhi', 'id': '75311070'}]"
2507,late happy holi ji hope iswar ki kripa se jald hi corona se free ho jaayega good day,en,"[{'screen_name': 'sheerin_sherry', 'name': 'sheerin', 'id': '998022864686075904'}]"
2508,panhandlers tell ceo google microsoft etc many indians working nasa role begger pakistan west development,en,[]
2509,tell dear going mr begger pakistani,en,[]
2510,god tax money way pakistan habit india interested deals beggers also see everyone begged,en,[]
2511,ji meri iccha hai saharanpur enter karte kanpur waala kaand ho jaaye jo vikas dubey ke saath hua tha,hi,[]
2512,suv,hi,[]
2513,way much paying twitter war getting less pay,en,"[{'screen_name': 'officialdgispr', 'name': 'dg ispr', 'id': '811505937911517184'}]"
2514,explain meaning go type english never heard life way indians much better begger porkistan,en,[]
2515,face tears joy face tears joy,und,[]
2516,first tell much loan india pay waste heart beat like friends,en,[]
2517,critics say happening bengal election purpose,en,[]
2518,face tears joy face tears joy,und,[]
2519,u cracking joke,en,[]
2520,first correct spelling well tell much loan india pay said india debt times country,en,[]
2521,really let see survive without us investment,en,[]
2522,way pay debt,en,[]
2523,cares sanctioned result usa losing biggest market world let,en,"[{'screen_name': 'potus45', 'name': 'president trump 45 archived', 'id': '822215679726100480'}, {'screen_name': 'potus', 'name': 'president biden', 'id': '1349149096909668363'}]"
2524,truth want save country needs win election antonio maino able defeat needs structural reform party,en,"[{'screen_name': 'bjp4india', 'name': 'bjp', 'id': '207809313'}, {'screen_name': 'incindia', 'name': 'congress', 'id': '1153045459'}, {'screen_name': 'rahulgandhi', 'name': 'rahul gandhi', 'id': '3171712086'}, {'screen_name': 'bjp4india', 'name': 'bjp', 'id': '207809313'}, {'screen_name': 'incindia', 'name': 'congress', 'id': '1153045459'}]"
2525,possible congress strong antonio maino give tight competition,en,"[{'screen_name': 'rahulgandhi', 'name': 'rahul gandhi', 'id': '3171712086'}, {'screen_name': 'bjp4india', 'name': 'bjp', 'id': '207809313'}]"
2526,understand,en,[]
2527,heard pm going become monk retirement critics saying cut beard bengal election,en,"[{'screen_name': 'narendramodi', 'name': 'narendra modi', 'id': '18839785'}]"
2528,downcast face sweat downcast face sweat,und,[]
2529,long time back watching dna ji thank filling gap ji,en,"[{'screen_name': 'mimansa_zee', 'name': 'mimansa malik', 'id': '1402100124'}, {'screen_name': 'sudhirchaudhary', 'name': 'sudhir chaudhary', 'id': '75246346'}]"
2530,face tears joy face tears joy,und,[]
2531,good morning ji thank motivational thoughts good day,en,"[{'screen_name': 'sheerin_sherry', 'name': 'sheerin', 'id': '998022864686075904'}]"
2532,please watch regular videos podcast tweet also get answer,en,[]
2533,india improve education system western people never come india study education system good visit,en,[]
2534,man announced billion dollars remove pm entire right wing govt world even successfully remove conservative party britain,en,"[{'screen_name': 'narendramodi', 'name': 'narendra modi', 'id': '18839785'}]"
2535,kahi aisa nahi aapke kaan ko jo suit karta hai vo ye nahi bolta kyoki aaj kal aap logo ne tak ko ka agent bata diya,hi,"[{'screen_name': 'majorgauravarya', 'name': 'major gaurav arya (retd)', 'id': '758859344561569792'}, {'screen_name': 'bjp4india', 'name': 'bjp', 'id': '207809313'}]"
2536,dear request upload full podcast,en,"[{'screen_name': 'anopenletter001', 'name': 'an open letter 😷', 'id': '950695755244695552'}, {'screen_name': 'spotify', 'name': 'spotify', 'id': '17230018'}]"
2537,matlab jo din raat ko gaali deta rahega pm ki patni tak par comment karega vo unbiased hota hai,hi,"[{'screen_name': 'bjp4india', 'name': 'bjp', 'id': '207809313'}]"
2538,kya opposite view rakhna ka bhakt hona kehte hai,hi,"[{'screen_name': 'bjp4india', 'name': 'bjp', 'id': '207809313'}]"
2539,sahi hai,hi,[]
2540,watching long time back kaha itne din tak thank ji ki raunak wapas laane ke liye big fan,en,"[{'screen_name': 'laffajpanditind', 'name': 'animesh pandey 🇮🇳', 'id': '2587002229'}, {'screen_name': 'tfipost', 'name': 'tfipost.com', 'id': '827185873301037056'}, {'screen_name': 'theatulmishra', 'name': 'atul mishra', 'id': '77273113'}, {'screen_name': 'tfipost', 'name': 'tfipost.com', 'id': '827185873301037056'}, {'screen_name': 'tfipost', 'name': 'tfipost.com', 'id': '827185873301037056'}]"
2541,opinion new bill make governor strong delhi,en,[]
2542,mantri ji koi suggestion vo apna gyan apne pass rakkhe,hi,[]
2543,thing regional parties also get tight competition work properly,en,"[{'screen_name': 'incindia', 'name': 'congress', 'id': '1153045459'}]"
2544,u really wants criticize try find loopholes division politics,en,[]
2545,madam gede banpur undeveloped area nadia district located india bangladesh border,en,[]
2546,madam lived gede banpur area months know speak hindi understand saying even many youths state understand hindi watching bollywood movie kerala tamil nadu people understand hindi,en,[]
2547,madam people bengal understand hindi well understand hindi watch hindi movies,en,[]
2548,paper hindi national language hindi spoken understood area india compared language except tamil kerala,en,[]
2549,thoda division politics kam khela kare vaise aapke strategist bihari hai dusro pe dosharopan kam kiya kare aur vaise rakesh tikait se campaign yashwant sinha ko tmc join karate samay yaad nahi aaya vo bahari hai,hi,[]
2550,think pakistani,en,[]
2551,,hi,[]
2552,sir ji kuch madari aksar kehte hai paisa faink tamasha dekh paise fekiye aur bandar kaise tamasha dikhate hai,hi,"[{'screen_name': 'gretathunberg', 'name': 'greta thunberg', 'id': '1006419421244678144'}, {'screen_name': 'rihanna', 'name': 'rihanna', 'id': '79293791'}]"
2553,ravan aur sita pehle se hi ab ram bhi chale gaye,hi,[]
2554,crying face crying face,und,[]
2555,crying face crying face,und,[]
2556,agar italy jaake election jeete jaate koi bhi ground level pe kaam nahi karta well agar rejected logo ko hum logo pe thopne ki iccha hai aap hi ko rejected log mubarak ho,hi,[]
2557,panelists ki class le rahi thi kya ji,in,"[{'screen_name': 'rubikaliyaquat', 'name': 'rubika liyaquat', 'id': '1062742964'}]"
2558,hope see next cm west bengal,en,[]
2559,congratulations sir entire team making success god bless,en,"[{'screen_name': 'zeenews', 'name': 'zee news', 'id': '461841349'}, {'screen_name': 'sudhirchaudhary', 'name': 'sudhir chaudhary', 'id': '75246346'}, {'screen_name': 'zeenews', 'name': 'zee news', 'id': '461841349'}]"
2560,tabhi desh ka haal behal hai kher samaj agar sahi ho jaaye sab kuch sahi ho sakta hai,hi,[]
2561,good morning ji ummid karta hu aaj ka din aapke liye anandmay rahe good day,en,"[{'screen_name': 'sheerin_sherry', 'name': 'sheerin', 'id': '998022864686075904'}]"
2562,acchi baat hai,hi,[]
2563,ye acchi baat hai yaha tak ki didi ne bangladeshi guspathio ke khilaaf bhi awaz uthai thi jo aaj unke vote ki bhuki hai,hi,"[{'screen_name': 'mamataofficial', 'name': 'mamata banerjee', 'id': '2526794479'}]"
2564,criticize pm policy want ministry happy party,en,"[{'screen_name': 'yashwantsinha', 'name': 'yashwant sinha', 'id': '856530759116402690'}, {'screen_name': 'shatrugansinha', 'name': 'shatrughan sinha', 'id': '2338104343'}]"
2565,one asked comment attract,en,[]
2566,sanjeev ji ke baare pata tha lekin nandini kumar real life ji hai ye nahi pata tha,hi,"[{'screen_name': 'shobhnayadava', 'name': 'shobhna yadav', 'id': '787218277659316226'}]"
2567,batla house movie jo character tha jise ne play kiya tha nandini vo actual ka character tha,en,"[{'screen_name': 'mrunal0801', 'name': 'mrunal thakur', 'id': '1008398461'}, {'screen_name': 'shobhnayadava', 'name': 'shobhna yadav', 'id': '787218277659316226'}]"
2568,face tears joy face tears joy matha thik ache,hi,[]
2569,anyone ask answer,en,[]
2570,har har bam bam,sv,[]
2571,think stop flop drama already seen accident happen anyone,en,"[{'screen_name': 'aitcofficial', 'name': 'all india trinamool congress', 'id': '290452792'}, {'screen_name': 'mamataofficial', 'name': 'mamata banerjee', 'id': '2526794479'}]"
2572,think accident happen didi went election commission work like pic,en,"[{'screen_name': 'mamataofficial', 'name': 'mamata banerjee', 'id': '2526794479'}]"
2573,happy birthday ji iswar aapko lambi aayu de aur mahabharat aapko aur energy de,tl,"[{'screen_name': 'sucherita_k', 'name': 'sucherita kukreti', 'id': '2785358773'}]"
2574,unke security force kya kar rahe waha,en,[]
2575,grinning squinting face grinning squinting face,und,[]
2576,e budget,en,[]
2577,dekhte hai,hi,[]
2578,agar rss ki vichardhara kattarvaadi waale hai assam west bengal kerala jinke saath coalition kiya hai vo konsi samajik prerna waali vichardhara hai,hi,[]
2579,bjs ko atal ji aur advani ji lead kar rahe,hi,[]
2580,naam aur symbol hi change kiya tha party aur vichardhar vo hi hai,hi,[]
2581,lekin kya bjp se pehle party ka naam bjs tha,fi,[]
2582,jin logo ne mamta per vote kiya hai kya vo election ke baad evm ka rona royenge,ht,[]
2583,mamata didi ke jeetne chance tha agar jaise neta hote,hi,"[{'screen_name': 'suvenduwb', 'name': 'suvendu adhikari • শুভেন্দু অধিকারী', 'id': '1340509422582333442'}, {'screen_name': 'aitcofficial', 'name': 'all india trinamool congress', 'id': '290452792'}]"
2584,vo kaise,lt,[]
2585,name aur symbol hi change hua hai neta aur vichardhara ek hi hai,hi,[]
2586,kyoki ke founder syama prasad bhi se hi sahi kaha naa,hi,"[{'screen_name': 'bjp4india', 'name': 'bjp', 'id': '207809313'}, {'screen_name': 'incindia', 'name': 'congress', 'id': '1153045459'}]"
2587,meaning kaun asli aur kaun nakli jaise delhi sabhi bengalis ka ho sakta hai kya bengal humara nahi hai,hi,[]
2588,rt ask ones religiously follow also troll threaten n opposition part,en,"[{'screen_name': 'khushsundar', 'name': 'khushbusundar', 'id': '122959195'}]"
2589,sahi hai dada ka rajneeti se dur rehna hi thik hai,hi,[]
2590,abbas siddiqui party contest nandigram definitely loose election,en,"[{'screen_name': 'mamataofficial', 'name': 'mamata banerjee', 'id': '2526794479'}]"
2591,grinning face sweat grinning face sweat,und,[]
2592,rt block roads city months name freedom speech amp claim freedom damage public properties,en,"[{'screen_name': 'manva_tweets', 'name': 'manvendra singh', 'id': '773741725953167360'}]"
2593,good day,hi,"[{'screen_name': 'avasthiaditi', 'name': 'aditi avasthi', 'id': '1408240723'}]"
2594,kya arnab goswami bengali bol sakte hai,in,[]
2595,galat kuch nahi kaha hai yashwant sinha ji ne kher rajneeti hai kya se kya ho jaaye dekhte dekhte,hi,[]
2596,need ott platform screening guidelines freedom creativity allow cross limits,en,[]
2597,freedom creativity ke naam pe kuch bhi banao aisa kaise ho sakta hai,hi,[]
2598,par secular gang kyo hai naraz,in,[]
2599,faith spirituality,en,[]
2600,message aap wins seats mcd,en,[]
2601,exactly say comparison state people join isis kerala,en,[]
2602,instead literature state largest number people join isis kerala right,en,[]
2603,campaign,en,"[{'screen_name': 'rahulgandhi', 'name': 'rahul gandhi', 'id': '3171712086'}, {'screen_name': 'bjp4india', 'name': 'bjp', 'id': '207809313'}, {'screen_name': 'narendramodi', 'name': 'narendra modi', 'id': '18839785'}]"
2604,way ye script kaha se likhvayi hai,hi,[]
2605,money donate anywhere mandir religious faith,en,[]
2606,ye dekhke girgit bhi hijab pehen le,hi,[]
2607,matlab lagaye bhi dikkhat naa lagaye bhi dikkhat gazab hai,hi,[]
2608,saamne rajyo chunav hai west bengal ahem hai aap se nivedan hai west bengal aur kerala aap chunavi rally ko sambodhan kare,hi,[]
2609,know leader like gulam nabi azad anand sharma ji win election ground level leaders loose people like etc guts give performance request impose us,en,"[{'screen_name': 'jm_scindia', 'name': 'jyotiraditya m. scindia', 'id': '2892809359'}, {'screen_name': 'himantabiswa', 'name': 'himanta biswa sarma', 'id': '131188226'}, {'screen_name': 'rahulgandhi', 'name': 'rahul gandhi', 'id': '3171712086'}]"
2610,bhai really want strong opposition front people reject party imposing us result loosing election even brother also leave party type behavior,en,"[{'screen_name': 'bjp4india', 'name': 'bjp', 'id': '207809313'}, {'screen_name': 'rahulgandhi', 'name': 'rahul gandhi', 'id': '3171712086'}, {'screen_name': 'shehzad_ind', 'name': 'shehzad jai hind', 'id': '392608775'}]"
2611,hope india one take seriously,en,[]
2612,nice portrait well done varun good artist,en,[]
2613,sahab kripya bhu lanka jaaye waha ka butter paneer bahut accha lagega aapko,hi,[]
2614,ise baukhlahat kehte hai,hi,[]
2615,lekin tamil nadu election one phase kyo waha west bengal baad sabse jyada seats hai,tl,[]
2616,nodeep kaur ka incident main jaanta nahi hu aur maine pehli baar naam suna hai main uspe koi comment nahi karunga,hi,[]
2617,ab maara pita hai ye mujhe nahi pata aapne rules follow nahi kiya aapko saza mili hai,hi,[]
2618,bilkul kyoki us time sakht nirdesh koi bhi common people waha allow nahi hai jo bhi waha reporting karega press card lena hi padega agar mandeep punia ki jagha main bhi iss tarah ki harqat karta main bhi jail jaata rules rule,hi,[]
2619,nice reply,en,[]
2620,iska matlab delhi violence jo involve unpe action bhi naa le,en,[]
2621,jab koi leftist arrest hota hai tab hi fascism desh badhne lagta hai,hi,[]
2622,payal rohtagi ko motilal nehru ki biwiya ginwaane ke aarop rajasthan police arrest kar leti hai tab fascism nahi hota kartik chitambaram pe tweet karne par ek aadmi ko arrest kar liya jaata hai tab fascism nahi aata fascism tab hi aa aata,hi,[]
2623,aur jab ke khilaaf kerala fir hoti hai kashmir ke roshni act ki reporting ko leke tab fascism nahi mehsus hota jab ko baby penguin kehne par maharashtra sarkar arrest kar leti hai tab fascism nahi hota,hi,"[{'screen_name': 'sudhirchaudhary', 'name': 'sudhir chaudhary', 'id': '75246346'}, {'screen_name': 'authackeray', 'name': 'aaditya thackeray', 'id': '1606048885'}]"
2624,without press card reporting karoge vo bhi usi area jaha press card ke bina reporting allow nahi hai police uthayegi rules khuleaam todoge police chod degi,en,[]
2625,bro information public domain hi hai police ne un logo ko hi arrest kiya hai jinhone red fort pe kaand kiya hai aur rahi baat disha ravi ki vo toolkit matter pe arrest hui hai kyoki sarkar ke khilaaf bhi bolte hai unhe kisine nahi uthaya,hi,"[{'screen_name': 'ravishndtv', 'name': 'ravish kumar', 'id': '47595335'}, {'screen_name': 'khanumarfa', 'name': 'arfa khanum sherwani', 'id': '113571686'}]"
2626,information wants farm law,en,[]
2627,,hi,[]
2628,ab ro kon raha ye sabko dikhai de raha hai kher ek hi advise dunga jisse agree nahi karte use apne argument se counter karo kyoki bhakt godi media argumentless people ke words hai,hi,[]
2629,told take picture bhindranwala,en,[]
2630,common photographs name proof take various events,en,[]
2631,heired lawyers gundas,en,"[{'screen_name': 'incindia', 'name': 'congress', 'id': '1153045459'}]"
2632,hope commit capitol hill red fort also protesting taking photos separatists,en,[]
2633,amrinder singh bjp se hai jinhone red fort violence aaropiyo ke liye lawyers heir kiya hai thank information,en,[]
2634,haa bhai police waalo ko red fort se niche fekna nangi talvaar leke dorana peaceful protest padta hai,et,[]
2635,har time zee news nahi rona chahiye agar aapke pass koi counter reply ho acchi baat hai varna ijjat bhare bazar utarti hai,hi,[]
2636,tabhi log soche aakhir ye rishta kya kehlaata hai,hi,[]
2637,,hi,[]
2638,agar koi kehta hai bjp ne girai hai bjp ka janadhar hi nahi hai waha,hi,[]
2639,,hi,[]
2640,nepotism kya hai kaabil logo ko ignore karke apne baccho ko kaabiliyat naa hote hue bhi usi field daalna,hi,[]
2641,face tears joy face tears joy rolling floor laughing rolling floor laughing well done bhai,en,"[{'screen_name': 'shambhav15', 'name': 'shambhav sharma', 'id': '1558267382'}]"
2642,hmm,und,[]
2643,vaise bhi open comment pe video itne bante bhi nahi hai,hi,[]
2644,communism russia se aaya hai china se nahi,tl,[]
2645,jinhone maharashtra govt ke liye tweet kiya tha ye sab dekhne ke bad inke tweet pe inquiry nahi baithegi,hi,[]
2646,,hi,[]
2647,,und,[]
2648,iphone,hi,"[{'screen_name': 'asthakaushik05', 'name': 'astha kaushik 🇮🇳', 'id': '806490776838369285'}]"
2649,ji tweet according considered freedom expression tweet agenda inquiry put loosing opposition day day,en,"[{'screen_name': 'incindia', 'name': 'congress', 'id': '1153045459'}]"
2650,everyone needs listen podcast always talk issue sides unbiasedly keep continue,en,"[{'screen_name': 'anopenletter001', 'name': 'an open letter 😷', 'id': '950695755244695552'}]"
2651,mohtarma punjab saaf dur ki baat bjp thi hi kab punjab jo saaf ho gayi,in,[]
2652,jaise congress ka ladna aur naa ladna equal hai,en,[]
2653,bhai punjab tin mukhya party hai congress aap aur akali bjp ka ladna aur naa ladna equal hai,hi,[]
2654,yaa aap kuch padh rahi hai kuch saja rahi hai yaa fir phone chalene busy hai aisa hi kuch aapki profile pic keh rahi hai aur dono ear rings aapko sunder bana raha hai,hi,[]
2655,climate activist anymore climate activist must ask question stubble burning creates smog personal request please complete school life whole life activism,en,[]
2656,family statement different restaurant owner also said restaurant closed,en,[]
2657,shadi kab kar rahe ho,hi,[]
2658,,hi,[]
2659,punjab dono jagha nazre tiki hui hai,hi,[]
2660,sir petrol diesel price l politics social media roads think come back,en,"[{'screen_name': 'incindia', 'name': 'congress', 'id': '1153045459'}, {'screen_name': 'incindia', 'name': 'congress', 'id': '1153045459'}]"
2661,unfortunately disagree example caa ka video aur aarey ka video,en,[]
2662,bro main iska daily viewer reh chuka ab main iske video kam dekhta hu,tl,[]
2663,getting backlash people,en,[]
2664,sorry maine kabhi kisi state govt ko criticize karte hue nahi dekha jo non bjp ruled agar kiya bhi hoga agar aur magar zaroor dekha hai,hi,[]
2665,questions questions either ask state govt central govt called hypocrisy outrage one side kept silent side critics must question govt,en,[]
2666,age number jail room simple,en,[]
2667,maine mana kab kiya hai central govt se sawal mat karo state se bhi karna chahiye,hi,[]
2668,aur vaise bhi aaj ke youth ko side dikha vo apna conclusion nikalna jaanta hai,hi,[]
2669,main ke deleted video ki baat kar raha hu us bakwas toolkit ki nahi,hi,"[{'screen_name': 'stringreveals', 'name': 'the string', 'id': '1240224660479860737'}]"
